{
  "schemaVersion": 1,
  "id": "archive-demo",
  "sourceID": "source-youtube-demo",
  "enumerator": "youtubeUploads",
  "selectedMode": "allAvailable",
  "observedAt": "2026-09-19T20:00:00Z",
  "catalogState": "complete",
  "analysisState": "partial",
  "selectedEpisodeIDs": [
    "yt-0",
    "yt-1",
    "yt-2",
    "yt-3",
    "yt-4",
    "yt-5",
    "yt-6",
    "yt-7",
    "yt-8",
    "yt-9",
    "yt-10",
    "yt-11",
    "yt-12",
    "yt-13",
    "yt-14",
    "yt-15",
    "yt-16",
    "yt-17",
    "yt-18",
    "yt-19",
    "yt-20",
    "yt-21",
    "yt-22",
    "yt-23",
    "yt-24",
    "yt-25",
    "yt-26",
    "yt-27",
    "yt-28",
    "yt-29",
    "yt-30",
    "yt-31",
    "yt-32",
    "yt-33",
    "yt-34",
    "yt-35",
    "yt-36",
    "yt-37",
    "yt-38",
    "yt-39",
    "yt-40",
    "yt-41",
    "yt-42",
    "yt-43",
    "yt-44",
    "yt-45",
    "yt-46",
    "yt-47",
    "yt-48",
    "yt-49",
    "yt-50",
    "yt-51",
    "yt-52",
    "yt-53",
    "yt-54",
    "yt-55",
    "yt-56",
    "yt-57",
    "yt-58",
    "yt-59",
    "yt-60",
    "yt-61",
    "yt-62",
    "yt-63",
    "yt-64",
    "yt-65",
    "yt-66",
    "yt-67",
    "yt-68",
    "yt-69",
    "yt-70",
    "yt-71",
    "yt-72",
    "yt-73",
    "yt-74",
    "yt-75",
    "yt-76",
    "yt-77",
    "yt-78",
    "yt-79",
    "yt-80",
    "yt-81",
    "yt-82",
    "yt-83",
    "yt-84",
    "yt-85",
    "yt-86",
    "yt-87",
    "yt-88",
    "yt-89",
    "yt-90",
    "yt-91",
    "yt-92",
    "yt-93",
    "yt-94",
    "yt-95",
    "yt-96",
    "yt-97",
    "yt-98",
    "yt-99",
    "yt-100",
    "yt-101",
    "yt-102",
    "yt-103",
    "yt-104",
    "yt-105",
    "yt-106",
    "yt-107",
    "yt-108",
    "yt-109",
    "yt-110",
    "yt-111",
    "yt-112",
    "yt-113",
    "yt-114",
    "yt-115",
    "yt-116",
    "yt-117",
    "yt-118",
    "yt-119"
  ],
  "discoveredCount": 120,
  "analyzableCount": 75,
  "analyzedCount": 20,
  "unavailableCount": 45,
  "nextCursor": null,
  "policy": {
    "autoAnalyzeNew": true,
    "analyzeHistory": true,
    "retainAudio": false,
    "network": "wifi"
  }
}
